{
  "$schema": "https://json-schema.org/draft/2020-12/schema",
  "$id": "https://example.com/product-ai-registry/schemas/pack.schema.json",
  "title": "Capability Pack",
  "type": "object",
  "required": ["id", "version", "description", "items"],
  "properties": {
    "id": { "type": "string" },
    "version": { "type": "string" },
    "description": { "type": "string" },
    "items": {
      "type": "array",
      "items": { "type": "string" }
    }
  }
}
